{
  "skill_name": "run-slide-report-modify",
  "prefix": "run",
  "kind": "run",
  "hierarchy_level": "L1",
  "trigger_conditions": [
    "スライドを修正したい",
    "レポートを部分修正したい",
    "slide-report-modify"
  ],
  "output_contract": "修正レポート(修正箇所一覧 + 変更差分 + 再評価スコア)",
  "boundary": "入力=既存成果物と修正指示/出力=局所修正済み HTML。新規生成は run-slide-report-generate、横断検証は run-cross-deck-review へ委譲する",
  "placement_candidates": [
    "Skill"
  ],
  "cli_tools": [
    "node"
  ],
  "deterministic_checks": [
    "validate-output-mode.py",
    "verify-slides.js"
  ],
  "external_systems": [],
  "mcp_tools": [],
  "needs_independent_context": true,
  "needs_lifecycle_enforcement": true,
  "checklist": [
    "修正対象と output_mode 特定",
    "指定箇所のみ部分修正",
    "修正後の再評価(視覚崩れ0)"
  ],
  "goal": "既存の slide deck / report を output_mode を保ったまま指定箇所だけ部分修正し、意匠/技術コアと非対象箇所を壊さず修正後の生成後評価で視覚崩れ0の状態",
  "mass_production_profile": "strict",
  "output_language": "ja",
  "purpose_background": "既存 slide-modifier(P4)の修正ワークフローを独立起動 skill として移植し、生成し直さず既存成果物の局所修正を安全に行うため",
  "responsibilities": [
    {
      "id": "R1-elicit",
      "summary": "修正対象の既存成果物と output_mode/修正指示をヒアリングして確定する",
      "prompt_required": true
    },
    {
      "id": "R2-modify",
      "summary": "slide-report-modifier を介し指定箇所のみを部分修正する",
      "prompt_required": true
    },
    {
      "id": "R3-reevaluate",
      "summary": "修正後に生成後評価を再実行し視覚崩れ0を確認して修正レポートを返す",
      "prompt_required": true
    }
  ]
}
